{
  "module_contract_schema_version": "0.1.0",
  "module_id": "WEAK_LINK_TAXONOMY",
  "module_version": "0.1.0",
  "module_kind": "ANALYTICAL",
  "stage_code": "DEEP_DIVE",
  "purpose": "Evaluate and transmit material weak-link findings under the frozen MATERIALITY + CAUSALITY + UNRESOLVEDNESS rule without changing score weights or terminal-gate methodology.",
  "authority": {
    "reads": [
      "EVIDENCE_LEDGER",
      "CONFLICT_LEDGER",
      "ASSUMPTION_REGISTER",
      "DEEP_DIVE_BLOCK_OUTPUTS"
    ],
    "writes": [
      "WEAK_LINK_TAXONOMY_ARTIFACT"
    ],
    "judgment_authority": true,
    "deterministic_authority": true,
    "forbidden_actions": [
      "CHANGE_SCORE_WEIGHTS",
      "CHANGE_OQS_OVS_FORMULAS",
      "SET_OROTITAN_STATUS_DIRECTLY",
      "SILENTLY_RESOLVE_EVIDENCE_CONFLICTS",
      "FABRICATE_ASSUMPTIONS",
      "TREAT_GENERIC_RISK_LABEL_AS_CAUSAL_MECHANISM",
      "WRITE_PRODUCTION"
    ]
  },
  "inputs": {
    "required_artifact_types": [
      "EVIDENCE_LEDGER",
      "CONFLICT_LEDGER",
      "ASSUMPTION_REGISTER"
    ],
    "required_exact_references": true,
    "required_stage_state": "IN_PROGRESS",
    "required_contract_pins": true,
    "data_cutoff_policy": "INHERIT_RUN_DATA_CUTOFF"
  },
  "dependencies": {
    "module_ids": [],
    "dependency_mode": "ANALYST_IMPACT_JUDGMENT"
  },
  "execution": {
    "status_authority": "DEEP_DIVE_BLOCK_LIFECYCLE",
    "status_vocabulary": [
      "INSUFFICIENT",
      "IN_PROGRESS",
      "PROVISIONALLY_STABLE",
      "LOCKED"
    ],
    "can_parallelize": true,
    "checkpoint_policy": "MODULE_ARTIFACT_ONLY",
    "retry_policy": "IDEMPOTENT_SAME_REQUEST",
    "fail_closed": true
  },
  "outputs": {
    "artifact_types": [
      "WEAK_LINK_TAXONOMY_ARTIFACT"
    ],
    "authority_class": "SUPPORTING_EXECUTION_ARTIFACT",
    "persistence_required": true,
    "hash_required": true
  },
  "uncertainty": {
    "unknown_policy": "PRESERVE_EXPLICIT",
    "not_applicable_policy": "REQUIRE_SEMANTIC_REASON",
    "missing_policy": "PRESERVE_AND_BLOCK_WHEN_REQUIRED",
    "assumption_policy": "EXPLICIT_TRACEABLE_NEVER_FABRICATE_TO_COMPLETE"
  },
  "recovery": {
    "recoverable_failures": [
      "MISSING_EXACT_EVIDENCE_REFERENCE",
      "MISSING_CONFLICT_REFERENCE",
      "SCHEMA_VALIDATION_FAILED"
    ],
    "reopen_triggers": [
      "NEW_MATERIAL_EVIDENCE",
      "MATERIAL_CONFLICT_REOPENED",
      "MITIGATION_STATUS_CHANGED",
      "TRANSMISSION_MECHANISM_CHANGED"
    ],
    "recovery_action": "REOPEN_STAGE"
  },
  "environment": {
    "allowed_environment": "VNEXT_SHADOW",
    "allowed_supabase_project_ref": "awgsurdyvsyolcgpnygh",
    "production_write_allowed": false
  }
}
