{
  "module_contract_schema_version": "0.1.0",
  "module_id": "CAPITAL_SEASONING",
  "module_version": "0.1.0",
  "module_kind": "ANALYTICAL",
  "stage_code": "DEEP_DIVE",
  "purpose": "Classify the maturity/seasoning state of material capital cohorts so recent deployment is not misread as mature return evidence, while preserving investment-lag, cohort and attribution rules without introducing fixed seasoning durations or new quality thresholds.",
  "authority": {
    "reads": [
      "EVIDENCE_LEDGER",
      "CALCULATION_LEDGER",
      "MATERIAL_ASSUMPTION_REGISTER",
      "RETURN_NORMALIZATION_ARTIFACT",
      "CAPITAL_DEPLOYMENT_LEDGER"
    ],
    "writes": [
      "CAPITAL_SEASONING_ARTIFACT"
    ],
    "judgment_authority": true,
    "deterministic_authority": true,
    "forbidden_actions": [
      "INVENT_FIXED_SEASONING_DURATION",
      "INVENT_RETURN_THRESHOLD",
      "TREAT_UNSEASONED_CAPITAL_AS_FAILED_RETURN",
      "TREAT_UNSEASONED_CAPITAL_AS_PROVEN_HIGH_RETURN",
      "COERCE_UNKNOWN_TO_SEASONED",
      "OVERRIDE_RETURN_NORMALIZATION",
      "CHANGE_RETURN_QUALITY_SCORE",
      "WRITE_PRODUCTION"
    ]
  },
  "inputs": {
    "required_artifact_types": [
      "EVIDENCE_LEDGER",
      "CALCULATION_LEDGER",
      "MATERIAL_ASSUMPTION_REGISTER",
      "RETURN_NORMALIZATION_ARTIFACT"
    ],
    "required_exact_references": true,
    "required_stage_state": "IN_PROGRESS",
    "required_contract_pins": true,
    "data_cutoff_policy": "INHERIT_RUN_DATA_CUTOFF"
  },
  "dependencies": {
    "module_ids": [
      "RETURN_NORMALIZATION"
    ],
    "dependency_mode": "ANALYST_IMPACT_JUDGMENT"
  },
  "execution": {
    "status_authority": "DEEP_DIVE_BLOCK_LIFECYCLE",
    "status_vocabulary": [
      "INSUFFICIENT",
      "IN_PROGRESS",
      "PROVISIONALLY_STABLE",
      "LOCKED"
    ],
    "can_parallelize": false,
    "checkpoint_policy": "MODULE_ARTIFACT_ONLY",
    "retry_policy": "IDEMPOTENT_SAME_REQUEST",
    "fail_closed": true
  },
  "outputs": {
    "artifact_types": [
      "CAPITAL_SEASONING_ARTIFACT"
    ],
    "authority_class": "SUPPORTING_EXECUTION_ARTIFACT",
    "persistence_required": true,
    "hash_required": true
  },
  "uncertainty": {
    "unknown_policy": "PRESERVE_EXPLICIT",
    "not_applicable_policy": "REQUIRE_SEMANTIC_REASON",
    "missing_policy": "PRESERVE_AND_BLOCK_WHEN_REQUIRED",
    "assumption_policy": "EXPLICIT_TRACEABLE_NEVER_FABRICATE_TO_COMPLETE"
  },
  "recovery": {
    "recoverable_failures": [
      "MISSING_CAPITAL_COHORT_EVIDENCE",
      "MISSING_DEPLOYMENT_DATE",
      "MISSING_IN_SERVICE_EVIDENCE",
      "MISSING_UTILIZATION_EVIDENCE",
      "SEASONING_STATE_CONFLICT",
      "SCHEMA_VALIDATION_FAILED"
    ],
    "reopen_triggers": [
      "NEW_CAPITAL_DEPLOYMENT",
      "IN_SERVICE_STATUS_CHANGED",
      "UTILIZATION_STATUS_CHANGED",
      "RAMP_STATUS_CHANGED",
      "RETURN_COHORT_EVIDENCE_CHANGED",
      "INVESTMENT_LAG_CHANGED",
      "ATTRIBUTABILITY_CHANGED"
    ],
    "recovery_action": "REOPEN_STAGE"
  },
  "environment": {
    "allowed_environment": "VNEXT_SHADOW",
    "allowed_supabase_project_ref": "awgsurdyvsyolcgpnygh",
    "production_write_allowed": false
  }
}
